{
  "schema": "microcosm.us.puf_2015_statistical_period_interpretation",
  "schema_version": 1,
  "interpretation_id": "us_puf_2015_statistical_period.v1",
  "authority": "documentary_interpretation_only",
  "grants": {
    "growth_authority": false,
    "scientific_admission": false,
    "release_admission": false,
    "tax_law_authority": false,
    "district_estimation_authority": false,
    "calibration_authority": false
  },
  "scope": {
    "question": "Whether the 2015 PUF's mixed reported FLPDYR values leave its statistical reference period unknown.",
    "answer": "No. The publisher documents an explicit substitution convention; the statistical reference period is Tax Year 2015 while each reported accounting period is preserved verbatim.",
    "resolves": "A narrower question than complete PUF scientific admission.",
    "supersedes_nothing": true,
    "predecessor_relationship": "stands_beside_never_replaces",
    "reading_note": "Documentary facts carry basis publisher_documented. The modeling convention is a proposal and is labelled separately."
  },
  "alternatives_considered": [
    {
      "alternative": "statistical_reference_period_unresolved",
      "held_by": "the earlier raw-source factor-admission plan",
      "status": "superseded_as_the_period_description_only",
      "reason": "It correctly preserved raw years but omitted the publisher's explicit prior-year substitution paragraph when describing the statistical period as unresolved.",
      "older_report_disposition": "kept_as_history_and_linked_as_additional_evidence"
    },
    {
      "alternative": "row_specific_price_conversion_using_reviewed_annual_indices",
      "status": "open_required_comparison",
      "reason": "A different sensitivity specification that could change the publisher's delivered distribution.",
      "constraint": "Must never be added silently or compounded with an overlapping nominal factor; the comparison is mandatory before any donor recipe receives scientific admission."
    },
    {
      "alternative": "treat_processing_year_2016_as_the_amount_growth_base",
      "status": "rejected",
      "reason": "PDF page 28 establishes the processing window, not an amount-growth base."
    }
  ],
  "raw_source_binding": {
    "definition_schema": "microcosm.us.puf_2015_raw_source_definition",
    "definition_schema_version": 1,
    "artifact_type_name": "microcosm.us.puf_2015_raw_return_status",
    "artifact_type_version": 1,
    "definition_sha256": "5664bfb87e804bfe220a8635a863866a0ede8f6143295e6b08bfc354114376dd",
    "definition_bytes": 9707,
    "preserved_period_semantics": "unresolved_raw_FLPDYR",
    "binding_kind": "identity_and_hash_only",
    "imports_predecessor_module": false,
    "retroactive_mutation": false,
    "note": "The predecessor records the delivered raw period semantics as unresolved_raw_FLPDYR. This interpretation does not rewrite that field, that definition, or any older receipt. A consumer may combine an authenticated raw artifact with this interpretation artifact; neither substitutes for the other."
  },
  "statistical_reference_period": {
    "tax_year": 2015,
    "basis": "publisher_documented",
    "publisher_statement": "The records found in this file are intended to represent all returns filed for Tax Year 2015.",
    "substitution_convention": "Returns for prior years were used in place of 2015 returns received and processed after December 31, 2016.",
    "evidence_pages": [
      {"document_page_ref": "sample_description_domain_of_study", "pdf_page": 28, "printed_page": 27}
    ],
    "does_not_establish": [
      "Not proof that every amount was earned in 2015.",
      "Not proof that the amounts on prior-year returns were restated into 2015 prices.",
      "Not permission to repair or overwrite any reported accounting-period token."
    ]
  },
  "reported_period_preservation": {
    "fields": ["FLPDYR", "FLPDMO"],
    "rule": "Preserve each delivered token exactly as delivered.",
    "delivered_FLPDYR_domain": [2012, 2013, 2014, 2015],
    "delivered_FLPDMO_domain": [12],
    "delivered_domain_basis": "observed_in_root_verified_header_audit_recorded_by_the_predecessor_definition",
    "automatic_row_year_repair": false,
    "inference_from_statistical_reference_period": false,
    "does_not_establish": "Not a single common observation period, and not permission to repair source tokens."
  },
  "processing_window": {
    "calendar_year": 2016,
    "basis": "publisher_documented",
    "publisher_statement": "The data in this file are estimates from a probability sample of unaudited Individual Income Tax Returns, Forms 1040, 1040A, 1040EZ (including electronic returns) filed by U.S. citizens and residents during Calendar Year 2016.",
    "exclusions": [
      "tentative returns were not subjected to sampling",
      "amended returns were excluded because the original returns had already been subjected to sampling",
      "returns with no income information or frivolous or fraudulent income information were excluded in calculating estimates",
      "this file excludes returns older than four years (Tax Year 2011 or less)",
      "fiscal year returns have been converted to reflect the most recent year-end Tax Year",
      "returns filed for years earlier than Tax Year 2012 have been removed from the file"
    ],
    "does_not_establish": "Not an amount-growth base of 2016."
  },
  "publisher_disclosure_avoidance": {
    "basis": "publisher_documented",
    "document_page_ref": "disclosure_avoidance_fiscal_conversion_and_aggregate_records",
    "pdf_page": 4,
    "printed_page": 3,
    "treatments": [
      {
        "id": "fiscal_period_conversion",
        "publisher_statement": "First, fiscal year returns have been converted to reflect the most recent year-end Tax Year and returns filed for years earlier than Tax Year 2012 have been removed from the file."
      },
      {
        "id": "extreme_value_aggregation",
        "publisher_statement": "Second, returns that contain one or more amount fields with values deemed extremely large have been excluded from the microdata sample and are aggregated into one of four records.",
        "RECID": [999996, 999997, 999998, 999999]
      },
      {
        "id": "high_income_no_tax_resubsampling",
        "publisher_statement": "Third, returns that were sampled as a high income no tax return, at a rate of 100 percent, have been placed back in their regular strata based on total income and subsampled at the corresponding strata rate."
      },
      {
        "id": "high_rate_subsampling",
        "publisher_statement": "Fourth, all remaining returns sampled at rates greater than 10 percent have been subsampled at 10 percent."
      },
      {
        "id": "multivariate_blurring",
        "publisher_statement": "Multivariate blurring has been applied to these returns with nonzero values in at least two of the following fields: wages and salaries, state and local income taxes, and real estate taxes.",
        "applies_to": "records sampled at a rate greater than 0.07 percent",
        "also_altered": [
          "alimony paid, alimony received and the State sales tax deduction removed",
          "marital status modified",
          "personal exemption amounts modified according to the phase-out limitations and moved to other items"
        ]
      }
    ],
    "later_audit_obligation": "State blurring and aggregate-record treatment explicitly; neither may be assumed away or silently repaired.",
    "does_not_establish": "Recording these publisher treatments does not quantify their effect on any distribution, and this resource performs no such quantification."
  },
  "geographic_meaning": {
    "national_only": true,
    "basis": "publisher_documented",
    "publisher_statement": "Subsequently, the 2015 Public Use Tax File is only appropriate for national level estimates.",
    "evidence_pages": [{"document_page_ref": "introduction_national_estimates", "pdf_page": 3, "printed_page": 2}],
    "does_not_establish": "Preserving the source's national interpretation does not validate transport to congressional districts."
  },
  "distinct_items": [
    {
      "item": "reported_accounting_period",
      "proposed_representation": "Preserve exact raw FLPDYR and FLPDMO, fiscal-period processing and the documentary conflict.",
      "does_not_establish": "Not a single common observation period, and not permission to repair source tokens."
    },
    {
      "item": "statistical_reference_period",
      "proposed_representation": "Tax year 2015, supported by the publisher's substitution convention.",
      "does_not_establish": "Not proof that every amount was earned or price-adjusted in 2015."
    },
    {
      "item": "processing_window",
      "proposed_representation": "Calendar 2016, with the stated exclusions and substitution procedure.",
      "does_not_establish": "Not an amount-growth base of 2016."
    },
    {
      "item": "later_transport_convention",
      "proposed_representation": "A separately reviewed statistical-baseline growth rule, with its factor basis and target reference period explicit.",
      "does_not_establish": "Not an IRS recommendation for QRF, calibration, or Microcosm's 2024 dataset."
    },
    {
      "item": "tax_benefit_law_period",
      "proposed_representation": "Established by the actual later rules engine.",
      "does_not_establish": "Never obtained by scaling a 2015 tax liability or credit."
    }
  ],
  "convention": {
    "convention_id": "us_puf_2015_statistical_baseline_growth.proposed.v1",
    "convention_status": "proposed",
    "convention_review": null,
    "growth_admitted": false,
    "label": "proposed_modeling_convention",
    "basis": "modeling_choice_not_publisher_documented",